{
  "schema_version": 2,
  "id": "matmul_claude-opus-5-cc-medium_mpi_r4",
  "benchmark": "matmul",
  "model": "claude-opus-5-cc-medium",
  "backend": "mpi",
  "repetition": 4,
  "batch": "20260901-162328",
  "source_path": "20260901-162328/matmul_claude-opus-5-cc-medium_mpi_r4",
  "args": [
    "-n",
    "6144"
  ],
  "timeout_seconds": 77,
  "configuration_sha256": "6ce918524cac238dfb3f05b7a3817a1c361910c0c76f5f7b4efbd4bc9576517d",
  "wall_seconds": [

  ],
  "warmup_wall_seconds": 13.863527968525887,
  "all_execution_wall_seconds": [
    13.863527968525887
  ],
  "executions": [
    {
      "repetition": "warmup",
      "success": false,
      "exit_code": 153,
      "term_signal": null,
      "timed_out": false,
      "wall_seconds": 13.863527968525887,
      "output_truncated": false
    }
  ],
  "success": false,
  "metrics": [

  ],
  "timing_fixed": true,
  "timing_correction": {
    "source_correction_amendment_sha256": "4ab7b8e012437d75654c73cfe7196c08f285644affcc82cdc38dcd7591af5186",
    "issue_categories": [
      "missing_start_synchronization",
      "missing_rank_aggregation",
      "rank_local_timing"
    ],
    "changed_paths": [
      "20260901-162328/matmul_claude-opus-5-cc-medium_mpi_r4/matmul/matmul.cpp"
    ],
    "original_source": {
      "commit": "db27e2872a28b900024d318f6a3004a3a7fddfa7",
      "digest": "5aaf14475b39ae58e73ff06f1b9c0cbd969d4b080665313e6da0250f2ae43413",
      "url": "https://github.com/PeterTh/llm-eval-generated/tree/db27e2872a28b900024d318f6a3004a3a7fddfa7/20260901-162328/matmul_claude-opus-5-cc-medium_mpi_r4"
    },
    "corrected_source": {
      "commit": "4500d708ad5c7b5d1594f93704011d6dfbca09a1",
      "digest": "bf307d32a1b7be74979f1e44798887659946cd015df141b8612f7383edbadb0e",
      "url": "https://github.com/PeterTh/llm-eval-generated/tree/4500d708ad5c7b5d1594f93704011d6dfbca09a1/20260901-162328/matmul_claude-opus-5-cc-medium_mpi_r4"
    },
    "build": {
      "success": true,
      "error": null,
      "staged_source_content_sha256": "a4c39986ed635ba8a6e7bc5f22e52363013b60f9091f11f5e1adfdca6a64dcd7",
      "temporary_workspace": "local /tmp; removed after attempt"
    }
  }
}
