{
  "schema_version": 2,
  "id": "cholesky_claude-opus-5-cc-medium_mpi_r4",
  "benchmark": "cholesky",
  "model": "claude-opus-5-cc-medium",
  "backend": "mpi",
  "repetition": 4,
  "batch": "20260901-162328",
  "source_path": "20260901-162328/cholesky_claude-opus-5-cc-medium_mpi_r4",
  "args": [
    "-n",
    "3072"
  ],
  "timeout_seconds": 64,
  "configuration_sha256": "6ce918524cac238dfb3f05b7a3817a1c361910c0c76f5f7b4efbd4bc9576517d",
  "wall_seconds": [

  ],
  "warmup_wall_seconds": 14.002142349258065,
  "all_execution_wall_seconds": [
    14.002142349258065
  ],
  "executions": [
    {
      "repetition": "warmup",
      "success": false,
      "exit_code": 153,
      "term_signal": null,
      "timed_out": false,
      "wall_seconds": 14.002142349258065,
      "output_truncated": false
    }
  ],
  "success": false,
  "metrics": [

  ],
  "timing_fixed": false,
  "timing_correction": null
}
